{
  "schema": 1,
  "mission_id": "mission-fixture-v06-001",
  "objective": "Produce one bounded, evidence-backed research result.",
  "constraints": [
    "no external writes",
    "preserve source provenance"
  ],
  "risk_class": "READ_ONLY",
  "budget": {
    "hard_limit_amount": null,
    "currency": null
  },
  "autonomy": {
    "mode": "GUARDED",
    "delegated_capabilities": []
  },
  "task_ids": [
    "task-fixture-v06-001"
  ],
  "artifact_refs": [],
  "evidence_refs": [],
  "approval_refs": [],
  "state": "READY",
  "created_at": "2026-10-01T05:20:00.000Z",
  "updated_at": "2026-10-01T05:20:00.000Z"
}
